<?xml version="1.0" encoding="UTF-8" ?>

<!-- https://stackoverflow.com/questions/34202967/xmlns-xmlnsxsi-xsischemalocation-and-targetnamespace/34204799 -->

<quickTips xmlns:xsi="http://www.w3.org/2001/XMLSchema-instance"
           xsi:noNamespaceSchemaLocation="QuickTip.xsd"> <!-- xsi:schemaLocation ??? -->
      <!-- xsi:schemaLocation="https://www.gshomework.com/xml QuickTip.xsd"> -->
  <quickTipAlgorithmUL>
    <amountRandomNumbers>5</amountRandomNumbers>
    <upperLimit>90</upperLimit>
  </quickTipAlgorithmUL>

  <quickTipAlgorithmAP>
    <amountRandomNumbers>5</amountRandomNumbers>
    <amountOfPanels>3</amountOfPanels>
  </quickTipAlgorithmAP>

  <quickTipAlgorithmULAP>
    <amountRandomNumbers>5</amountRandomNumbers>
    <upperLimit>90</upperLimit>
    <amountOfPanels>3</amountOfPanels>
  </quickTipAlgorithmULAP>>

</quickTips>